Topic,Count,Name,Representation,Representative_Docs
4,324,4_decision_fuzzy_decision making_making,"['decision', 'fuzzy', 'decision making', 'making', 'criteria', 'method', 'proposed', 'based', 'consensus', 'linguistic']","[""Abstract In a decision-making process, a decision maker is often able to express his/her preferences of importance of the evaluative criteria only linguistically. These linguistic terms can be expressed as triangular fuzzy numbers. To make a decision about the set of alternatives that are evaluated by differently important criteria, a method of decision-making theory can be applied. Many theories do not accept criteria importance in the format of fuzzy numbers, which means that fuzzy numbers must be transformed into criteria weights. For this purpose, not many methods are known. Based on a literature review, Lai and Hwang's optimization approach is selected because this method has least number of shortcomings. Therefore, this method is researched in more detail. The specified problems with the optimization model are eliminated by the proposed improvements and a new comprehensive fuzzy weights estimation method is introduced. Some proposals are explained through illustrative examples. Easy applicability of the proposed method is demonstrated on a real case of making a portfolio of open unit trusts."", 'Abstract Hesitant fuzzy set (HFS) has been a very popular and useful tool to express the uncertainty of decision makers (DMs) when they could not give a determination among several different values in the process of representing preferences. In this paper, we mainly focus on digging the potential/deeper uncertain information of the DMs when they use HFSs to express their evaluation information in the process of decision making. As a result, a new fuzzy information form called normal wiggly hesitant fuzzy set (NWHFS) is proposed to assist the DMs in expressing their evaluation information more completely and improve the rationality of the decision-making result. The NWHFS can keep the hesitant fuzzy information and the deeper uncertain information dug in the hesitant fuzzy information. After that, we propose a score function of normal wiggly hesitant fuzzy information to distinguish the NWHFSs. Moreover, to understand and apply the NWHFSs easily, we investigate some properties of the NWHFSs and propose two preliminary aggregation operators of the NWHFSs. Finally, we use a numerical example involving environmental quality evaluation to verify the efficiency and applicability of the NWHFSs in decision-making and make a comparison between the proposed method and the existing decision-making method.', 'Hesitant fuzzy linguistic preference relation (HFLPR) is of interest because it provides an efficient way for opinion expression under uncertainty. For enhancing the theory of decision making with HFLPR, the paper introduces an algorithm for group decision making with HFLPRs based on the acceptable consistency and consensus measurements, which involves (1) defining a hesitant fuzzy linguistic geometric consistency index (HFLGCI) and proposing a procedure for consistency checking and inconsistency improving for HFLPR; (2) measuring the group consensus based on the similarity between the original individual HFLPRs and the overall perfect HFLPR, then establishing a procedure for consensus ensuring including the determination of decision-makers weights. The convergence and monotonicity of the proposed two procedures have been proved. Some experiments are furtherly performed to investigate the critical values of the defined HFLGCI, and comparative analyses are conducted to show the effectiveness of the proposed algorithm. A case concerning the performance evaluation of venture capital guiding funds is given to illustrate the availability of the proposed algorithm. As an application of our work, an online decision-making portal is finally provided for decision-makers to utilize the proposed algorithms to solve decision-making problems.']"
5,138,5_mining_data_rough_attribute,"['mining', 'data', 'rough', 'attribute', 'set', 'utility', 'patterns', 'based', 'rules', 'algorithm']","['Abstract As big data often contains a significant amount of unstructured, imprecise, and uncertain data, the fuzzy-rough-set-based attribute reduction is a valuable technique for uncertainty reasoning and data mining. However, tradition fuzzy-rough-set algorithms take all data correlations into account, which may lead to challenging requirements for computing and memory space resources. In this paper, we propose a novel Multigranulation Consensus Fuzzy-Rough Attribute Reduction (MCFR) algorithm for big data analysis, which assigns tasks to multiple nodes for parallel computing with different multigranulation weights and creates reasonable granular subpopulations for attribute reduction. A multigranulation margin model with a self-evolving consensus scheme is constructed wherein super elitists are classified into different multigranulation populations using the weighted margins’ matrix to calculate the parallel positive regions. This model allows penalizing super elitists with cooperative behaviors from coarsening to refining. A cascade cross-coevolutionary multigranulation learning model utilizes a more efficient coevolutionary attribute classification with multigranulation flexible thresholds. Here, the super elitist crossover learning strategy is employed to search for elitists’ chromosomes in granular subpopulations to yield better objective function values for handling dynamic big data classification tasks. Our experimental results demonstrate that MCFR can achieve a high performance in addressing uncertainty and fuzzy attribute reduction problems for big datasets with increasing noise. We also demonstrate a practical application of MCFR by using it to automatically segment fMRIs of the neonatal brain tissues at both the global and tissue levels. The results were in the good agreement with expert manual classifications, thus introducing a new method for the medical decision\xa0support\xa0problem of predicting disorders from neonatal brain fMRIs.', 'Abstract Data mining techniques are intensively used to uncover relevant patterns in large volumes of complex data which are continuously extended with newly arrived data instances. Relational association rules (RARs), a data analysis and mining concept, have been introduced as an extension of classical association rules (ARs) for capturing various relationships between the attributes characterizing the data. Due to its NP-completeness, the problem of mining all the interesting RARs within a data set is computationally difficult. As the dimensionality of the data set to be mined increases, the classical algorithm Discovery of Relational Association Rules (DRAR) for RARs mining fails in providing the set of rules in reasonable time. This paper introduces a new approach named CRAR (Concurrent Relational Association Rule mining) which uses concurrency for the RARs discovery process and thus significantly reduces the mining time. The effectiveness of CRAR is empirically validated on nine open source data sets. The reduction in mining time when using CRAR against DRAR emphasizes that it can be successfully applied in various practical data mining scenarios.', 'Abstract High-utility sequential pattern mining (HUSPM) is the task of discovering all sequential patterns in a sequence database whose utility values are equal to or greater than a given minimum utility threshold. HUSPM has become increasingly important in many real-world data mining applications, such as market basket data analysis, weblog mining, and bio-medical gene data analysis, which considers co-occurrence values and quantity, utility (e.g., profit or cost) and time. Current approaches in the literature for HUSPM use the utility matrix to store a sequence database in the memory. Unfortunately, the utility matrix consumes a large amount of main memory. To address this issue, we introduce a pure array structure that reduces the memory consumption when compared to the utility matrix. In addition, HUSPM is also challenged with the downward closure property (DCP) to prune the search space. Recently, HUSPM algorithms have used the upper bound of utility values as the DCP. However, it is usually higher than the actual utility of patterns. Thus, these algorithms may generate many candidate patterns. The large search space leads to poor performance due to excessive runtime and memory usage. One of the reasons is the number of candidate patterns is proportional to the number of requisite projected database scans for calculating their actual utilities. In this paper, we present a novel pruning strategy that efficiently prunes non-HUSPs and significantly reduces the search space compared to the state-of-the-art HUS-Span algorithm. Moreover, we propose a parallel strategy to speed up the mining process. Then, we propose two algorithms which are the pure Array structure for High-utility Sequential (AHUS) pattern mining and AHUS parallel mining (AHUS-P). The AHUS-P algorithm uses shared memory to parallelize the mining process. It concurrently identifies HUSPs based on the advantages of the multi-core processor architecture. The experimental results show that AHUS and AHUS-P can efficiently and effectively discover all HUSPs. Both the proposed algorithms outperform the state-of-the-art HUS-Span algorithm in terms of runtime, memory usage, and scalability for all experimental datasets.']"
6,82,6_clustering_clusters_cluster_algorithm,"['clustering', 'clusters', 'cluster', 'algorithm', 'data', 'density', 'means', 'algorithms', 'clustering algorithms', 'clustering algorithm']","['Abstract A variety of algorithms have recently emerged in the field of cluster analysis. Consequently, based on the distribution nature of the data, an appropriate algorithm can be chosen for the purpose of clustering. It is difficult for a user to decide a priori which algorithm would be the most appropriate for a given dataset. Algorithms based on graphs provide good results for this task. However, these algorithms are vulnerable to outliers with limited information about edges contained in the tree to split a dataset. Thus, in several fields, the need for better clustering algorithms increases and for this reason utilizing robust and dynamic algorithms to improve and simplify the whole process of data clustering has become an urgent need. In this paper, we propose a novel distance-based clustering algorithm called the critical distance clustering algorithm. This algorithm depends on the Euclidean distance between data points and some basic mathematical statistics operations. The algorithm is simple, robust, and flexible; it works with quantitative data that are real-valued, not qualitative, and categorical with different dimensions. In this work, 26 experiments are conducted using different types of real and synthetic datasets taken from different fields. The results prove that the new algorithm outperforms some popular clustering algorithms such as MST-based clustering, K-means, and Dbscan. Moreover, the algorithm can precisely produce more reasonable clusters even when the dataset contains outliers and without specifying any parameters in advance. It also provides a number of indicators to evaluate the established clusters and prove the validity of the clustering.', 'Abstract Expert and intelligent systems use a variety of machine learning techniques to obtain and understand the information inherent in the data. Clustering is one of these techniques, which has become important and popular since it allows classifying an unlabeled dataset into clusters of similar objects. There are many clustering algorithms that have been proposed in the literature. From these algorithms, the Cross-Clustering algorithm is one of the most recent clustering algorithms for partial clustering (clustering where not necessarily all the objects are grouped into clusters), which has provided good results allowing estimating a suitable set of clusters, as well as eliminating outliers. However, this algorithm tends to eliminate too many objects as outliers, which leads to discard a lot of non-outlier objects. Additionally, the Cross-Clustering algorithms spends a lot of time evaluating several combinations of clusterings, trying to determine a suitable number of clusters. To overcome these problems, in this paper, an improved version of the Cross-Clustering algorithm (ICC) is proposed. ICC changes the clustering algorithm used for detecting outliers, as well as it modifies the way outliers are detected. Moreover, a stop criterion allowing to make a fast decision on the estimation of a suitable number of cluster, is also introduced. The performance of the improved Cross-Clustering algorithm is compared with the original algorithm on artificial and real datasets. Our results show that ICC improves the original algorithm and other state of the art clustering algorithms; in both, runtime and clustering quality.', 'Abstract Many clustering algorithms categorized as K-clustering algorithm require the user to predict the number of clusters (K) to do clustering. Due to lack of domain knowledge an accurate value of K is difficult to predict. The problem becomes critical when the dimensionality of data points is large; clusters differ widely in shape, size, and density; and when clusters are overlapping in nature. Determining the suitable K is an optimization problem. Automatic clustering algorithms can discover the optimal K. This paper presents an automatic clustering algorithm which is superior to K-clustering algorithm as it can discover an optimal value of K. Iterative hill-climbing algorithms like K-Means work on a single solution and converge to a local optimum solution. Here, Genetic Algorithms (GAs) find out near global optimum solutions, i.e. optimal K as well as the optimal cluster centroids. Single-objective clustering algorithms are adequate for efficiently grouping linearly separable clusters. For non-linearly separable clusters they are not so good. So for grouping non-linearly separable clusters, we apply Multi-Objective Genetic Algorithm (MOGA) by minimizing the intra-cluster distance and maximizing inter-cluster distance. Many existing MOGA based clustering algorithms are suitable for either numeric or categorical features. This paper pioneered employing MOGA for automatic clustering with mixed types of features. Statistical testing on experimental results on real-life benchmark data sets from the University of California at Irvine (UCI) machine learning repository proves the superiority of the proposed algorithm.']"
7,68,7_privacy_data_federated_preserving,"['privacy', 'data', 'federated', 'preserving', 'learning', 'differential', 'users', 'protection', 'information', 'private']","['Abstract Many models have been proposed to preserve data privacy for different data publishing scenarios. Among these models, ϵ -differential privacy has drawn increasing attention in recent years due to its rigorous privacy guarantees. While many existing solutions using ϵ -differential privacy deal with relational data and set-valued data separately, most of the real-life data, such as electronic health records, are in heterogeneous form. Privacy protection on heterogeneous data has not been widely studied. Furthermore, many existing works in privacy protection consider preserving the utility for the tasks of frequent itemset mining or classification analysis, but few works have focused on data publication for cluster analysis. In this paper, we propose the first differentially-private solution to release heterogeneous data for cluster analysis. The challenge facing us is how to mask raw data without any explicit guidance. Our approach addresses this challenge by converting a clustering problem to a classification problem, in which class labels can be used to encode the cluster structure of the raw data and assist the masking process. The approach generalizes the raw data probabilistically and adds noise to them for satisfying ϵ -differential privacy. Through extensive experiments on real-life datasets, we validate the performance of our approach.', 'Abstract Location-based services, such as DiDi and bike sharing, are becoming increasingly popular. However, the use of these services raises privacy concerns. In the past few years, differential privacy technology has been applied to location information protection. However, most existing models largely fail to resist complex background-knowledge attacks. This paper proposes a novel privacy preservation method for trajectory data. It is based on a prefix tree and uses differential privacy. It should be noted that existing methods only consider either a certain location point or the entire trajectory. In the proposed prefix tree structure, the nodes of the tree store the trajectory segments. The parameter minimum description length method is combined with the Dijkstra method to select feature trajectory points that represent the entire trajectory, thus further reducing the (computational) complexity of data processing. To protect privacy, Laplacian noise is added to the location data of trajectory segments by using differential privacy. In addition, a background and contextual information attack model is proposed, and the corresponding protection method is provided. Finally, a Markov chain is used to limit the size of the noise added to the data. The proposed algorithm is compared with related state-of-the-art algorithms on a public dataset. The results demonstrate that our algorithm can ensure not only privacy but also data availability.', ""Probabilistic matrix factorization (PMF) plays a crucial role in recommendation systems. It requires a large amount of user data (such as user shopping records and movie ratings) to predict personal preferences, and thereby provides users high-quality recommendation services, which expose the risk of leakage of user privacy. Differential privacy, as a provable privacy protection framework, has been applied widely to recommendation systems. It is common that different individuals have different levels of privacy requirements on items. However, traditional differential privacy can only provide a uniform level of privacy protection for all users. \nIn this paper, we mainly propose a probabilistic matrix factorization recommendation scheme with personalized differential privacy (PDP-PMF). It aims to meet users' privacy requirements specified at the item-level instead of giving the same level of privacy guarantees for all. We then develop a modified sampling mechanism (with bounded differential privacy) for achieving PDP. We also perform a theoretical analysis of the PDP-PMF scheme and demonstrate the privacy of the PDP-PMF scheme. In addition, we implement the probabilistic matrix factorization schemes both with traditional and with personalized differential privacy (DP-PMF, PDP-PMF) and compare them through a series of experiments. The results show that the PDP-PMF scheme performs well on protecting the privacy of each user and its recommendation quality is much better than the DP-PMF scheme.""]"
8,65,8_process_event_systems_software,"['process', 'event', 'systems', 'software', 'data', 'business', 'rules', 'knowledge', 'models', 'processes']","['We introduce a semantics for Multi Perspective Declare (MP-Declare).We introduce an abstract syntax for MP-Declare.We provide a set of algorithms for conformance checking based on MP-DeclareThe approach has been implemented in the process mining tool ProM.The approach has been demonstrated with real life data. Process mining is a family of techniques that aim at analyzing business process execution data recorded in event logs. Conformance checking is a branch of this discipline embracing approaches for verifying whether the behavior of a process, as recorded in a log, is in line with some expected behavior provided in the form of a process model. Recently, techniques for conformance checking based on declarative specifications have been developed. Such specifications are suitable to describe processes characterized by high variability. However, an open challenge in the context of conformance checking with declarative models is the capability of supporting multi-perspective specifications. This means that declarative models used for conformance checking should not only describe the process behavior from the control flow point of view, but also from other perspectives like data or time. In this paper, we close this gap by presenting an approach for conformance checking based on MP-Declare, a multi-perspective version of the declarative process modeling language Declare. The approach has been implemented in the process mining tool ProM and has been experimented using artificial and real-life event logs.', 'Abstract Predictive monitoring of business processes is a challenging topic of process mining which is concerned with the prediction of process indicators of running process instances. The main value of predictive monitoring is to provide information in order to take proactive and corrective actions to improve process performance and mitigate risks in real time. In this paper, we present an approach for predictive monitoring based on the use of evolutionary algorithms. Our method provides a novel event window-based encoding and generates a set of decision rules for the run-time prediction of process indicators according to event log properties. These rules can be interpreted by users to extract further insight of the business processes while keeping a high level of accuracy. Furthermore, a full software stack consisting of a tool to support the training phase and a framework that enables the integration of run-time predictions with business process management systems, has been developed. Obtained results show the validity of our proposal for two large real-life datasets: BPI Challenge 2013 and IT Department of Andalusian Health Service (SAS).', 'Abstract Information systems daily register a large amount of data in event logs. All these data can be used for the organizations to automatically discover their process models. However, the automatic construction of simple process models with consistently high and balanced fitness and precision remains a challenging task, which has attracted the attention in the scientific and organizational communities to develop suitable methods for creating high-quality business process models. In this paper, we present an approach to discover the model of a business process based on the Business Process Model and Notation (BPMN) standard from its behavior observed in event logs. Particularly, we propose: 1) a method to detect outlier behavior in a given event log; 2) a set of heuristic rules to discover join gateways associated with the closing of each of the split gateways in conformance with the rules of BPMN models; and 3) P-Miner, a tool that realizes our proposed approach to automatically discover and visualize process models. We use a state of the art process discovery technique as a basis for discovering XOR/AND gateways in the models. A set of experiments was carried out on real and artificial event logs for evaluating our proposal, considering the fitness and precision metrics to determine the quality of the built models. The amount of gateways in the resulting BPMN model and the time required to build the process models were estimated. The results reveal that the process models derived by our proposed approach exhibited competitive and more balanced results in fitness and precision than those derived with other discovery techniques.']"
